{
  "$schema": "../schema/brand.schema.json",
  "$description": "Generated in the theme builder by @ux-builder/engine 0.1.0, strategy vibrant. Regenerate with: npm run brand -- --regenerate tokens/brands/ux-builder.brand.json",
  "name": "ux-builder",
  "title": "Ux Builder",
  "appearances": {
    "light": {
      "color": {
        "ground": {
          "$value": "#FAF9FF",
          "$description": "Page ground. Generated (vibrant)."
        },
        "ground-recessed": {
          "$value": "#F2EFFF",
          "$description": "Recessed ground (sidebar). Generated (vibrant)."
        },
        "surface": {
          "$value": "#FFFFFF",
          "$description": "Cards, fields and menus. Generated (vibrant)."
        },
        "surface-sunken": {
          "$value": "#F0EEFF",
          "$description": "Sunken panels and pills. Generated (vibrant)."
        },
        "border": {
          "$value": "#DFD9FA",
          "$description": "Borders. Generated (vibrant)."
        },
        "text-strong": {
          "$value": "#180F2E",
          "$description": "Headings. Generated (vibrant)."
        },
        "text": {
          "$value": "#261D3E",
          "$description": "Body text. Generated (vibrant)."
        },
        "text-muted": {
          "$value": "#4E476B",
          "$description": "Muted text. Generated (vibrant)."
        },
        "text-subtle": {
          "$value": "#655D83",
          "$description": "Subtle text. Generated (vibrant)."
        },
        "structure": {
          "$value": "#6F00E0",
          "$description": "Primary buttons: brand colour. Generated (vibrant)."
        },
        "accent": {
          "$value": "#6F00E0",
          "$description": "Links, focus, kickers: brand colour. Generated (vibrant)."
        },
        "on-accent": {
          "$value": "#FFFFFF",
          "$description": "Text and icons on the accent. Generated (vibrant)."
        }
      },
      "state": {
        "live": {
          "$value": "#007C59",
          "$description": "Status: live. Generated (vibrant)."
        },
        "limited": {
          "$value": "#A25900",
          "$description": "Status: limited. Generated (vibrant). #A75C00 moved −0.010 L (OKLCH, hue kept) to clear 4.5:1."
        },
        "purchasing": {
          "$value": "#3959A6",
          "$description": "Status: purchasing. Generated (vibrant)."
        },
        "closed": {
          "$value": "#B8284D",
          "$description": "Status: closed. Generated (vibrant)."
        },
        "evaluation": {
          "$value": "#4E476B",
          "$description": "Status: evaluation (muted). Generated (vibrant)."
        }
      },
      "brand": {
        "logo-paint": {
          "$value": "#752EE2",
          "$description": "The logo's top brand colour, as supplied."
        },
        "logo-image": {
          "$value": "../../brand/ux-builder/logo-framed.svg",
          "$description": "The logo, as uploaded to the theme builder, framed to its drawing."
        },
        "logo-aspect": {
          "$value": "4.598",
          "$description": "The framed logo's width over its height."
        }
      }
    },
    "dark": {
      "color": {
        "ground": {
          "$value": "#120F1E",
          "$description": "Page ground. Generated (vibrant)."
        },
        "ground-recessed": {
          "$value": "#0C0817",
          "$description": "Recessed ground (sidebar). Generated (vibrant)."
        },
        "surface": {
          "$value": "#1D1A2A",
          "$description": "Cards, fields and menus. Generated (vibrant)."
        },
        "surface-sunken": {
          "$value": "#272434",
          "$description": "Sunken panels and pills. Generated (vibrant)."
        },
        "border": {
          "$value": "#36314A",
          "$description": "Borders. Generated (vibrant)."
        },
        "text-strong": {
          "$value": "#F8F7FF",
          "$description": "Headings. Generated (vibrant)."
        },
        "text": {
          "$value": "#ECE8FF",
          "$description": "Body text. Generated (vibrant)."
        },
        "text-muted": {
          "$value": "#BFB7E2",
          "$description": "Muted text. Generated (vibrant)."
        },
        "text-subtle": {
          "$value": "#A098C1",
          "$description": "Subtle text. Generated (vibrant)."
        },
        "structure": {
          "$value": "#AA8EFF",
          "$description": "Primary buttons: brand colour. Generated (vibrant)."
        },
        "accent": {
          "$value": "#AA8EFF",
          "$description": "Links, focus, kickers: brand colour. Generated (vibrant)."
        },
        "on-accent": {
          "$value": "#0D0421",
          "$description": "Text and icons on the accent. Generated (vibrant)."
        }
      },
      "state": {
        "live": {
          "$value": "#4BC899",
          "$description": "Status: live. Generated (vibrant)."
        },
        "limited": {
          "$value": "#FFB06E",
          "$description": "Status: limited. Generated (vibrant)."
        },
        "purchasing": {
          "$value": "#7CA2F6",
          "$description": "Status: purchasing. Generated (vibrant)."
        },
        "closed": {
          "$value": "#F86680",
          "$description": "Status: closed. Generated (vibrant)."
        },
        "evaluation": {
          "$value": "#BFB7E2",
          "$description": "Status: evaluation (muted). Generated (vibrant)."
        }
      },
      "brand": {
        "logo-paint": {
          "$value": "#752EE2",
          "$description": "The logo's top brand colour, as supplied."
        },
        "logo-image": {
          "$value": "../../brand/ux-builder/logo-framed.svg",
          "$description": "The logo, as uploaded to the theme builder, framed to its drawing."
        },
        "logo-aspect": {
          "$value": "4.598",
          "$description": "The framed logo's width over its height."
        }
      }
    }
  },
  "generation": {
    "engine": "0.1.0",
    "extracted": [
      "#752EE2",
      "#20D5F7",
      "#647CF0",
      "#39B5F5",
      "#A034EA"
    ],
    "strategy": "vibrant",
    "settings": {
      "strategies": "faithful,muted,vibrant,neutral-accent,two-colour",
      "primaryCandidate": 0,
      "secondaryCandidate": -1,
      "hueShift": 0,
      "chromaScale": 1,
      "neutralTint": 1,
      "groundLight": 0.985,
      "groundDark": 0.18,
      "stateHarmony": 0.5,
      "minContrast": 4.5,
      "suggestedHue": 250,
      "appearances": "light,dark"
    },
    "logo": {
      "path": "../../brand/ux-builder/logo.svg",
      "sha256": "3125d025d357f714499166b62e6b9ca49939d357403bd292ff9e9e43b7316d72"
    }
  }
}
