{
  "$schema": "../../../tokens/schema/brand.schema.json",
  "$description": "Generated by @ux-builder/engine 0.1.0 from two-colour.svg, strategy two-colour (option \"two-colour\"). Regenerate with: npm run brand -- --regenerate tests/fixtures/brands/sample.brand.json",
  "name": "sample",
  "title": "Sample",
  "appearances": {
    "light": {
      "color": {
        "ground": {
          "$value": "#F7FAFF",
          "$description": "Page ground. Generated (two-colour)."
        },
        "ground-recessed": {
          "$value": "#EFF2F7",
          "$description": "Recessed ground (sidebar). Generated (two-colour)."
        },
        "surface": {
          "$value": "#FFFFFF",
          "$description": "Cards, fields and menus. Generated (two-colour)."
        },
        "surface-sunken": {
          "$value": "#EDF0F6",
          "$description": "Sunken panels and pills. Generated (two-colour)."
        },
        "border": {
          "$value": "#D9DEE6",
          "$description": "Borders. Generated (two-colour)."
        },
        "text-strong": {
          "$value": "#12161D",
          "$description": "Headings. Generated (two-colour)."
        },
        "text": {
          "$value": "#1F242C",
          "$description": "Body text. Generated (two-colour)."
        },
        "text-muted": {
          "$value": "#484D56",
          "$description": "Muted text. Generated (two-colour)."
        },
        "text-subtle": {
          "$value": "#5E646D",
          "$description": "Subtle text. Generated (two-colour)."
        },
        "structure": {
          "$value": "#1F5FBF",
          "$description": "Primary buttons: brand colour. Generated (two-colour)."
        },
        "accent": {
          "$value": "#AE5E00",
          "$description": "Links, focus, kickers: second brand colour. Generated (two-colour). #F28C28 moved −0.170 L (OKLCH, hue kept) to clear 4.5:1; flagged for review."
        },
        "on-accent": {
          "$value": "#F5F9FF",
          "$description": "Text and icons on the accent. Generated (two-colour). #070B12 moved +0.830 L (OKLCH, hue kept) to clear 4.5:1; flagged for review."
        }
      },
      "state": {
        "live": {
          "$value": "#007C59",
          "$description": "Status: live. Generated (two-colour)."
        },
        "limited": {
          "$value": "#8B6600",
          "$description": "Status: limited. Generated (two-colour). #916B00 moved −0.015 L (OKLCH, hue kept) to clear 4.5:1."
        },
        "purchasing": {
          "$value": "#205EA5",
          "$description": "Status: purchasing. Generated (two-colour)."
        },
        "closed": {
          "$value": "#B8284D",
          "$description": "Status: closed. Generated (two-colour)."
        },
        "evaluation": {
          "$value": "#484D56",
          "$description": "Status: evaluation (muted). Generated (two-colour)."
        }
      },
      "brand": {
        "logo-paint": {
          "$value": "#1F5FBF",
          "$description": "The logo's top brand colour, as supplied."
        }
      }
    },
    "dark": {
      "color": {
        "ground": {
          "$value": "#0F1215",
          "$description": "Page ground. Generated (two-colour)."
        },
        "ground-recessed": {
          "$value": "#090B0F",
          "$description": "Recessed ground (sidebar). Generated (two-colour)."
        },
        "surface": {
          "$value": "#1B1D21",
          "$description": "Cards, fields and menus. Generated (two-colour)."
        },
        "surface-sunken": {
          "$value": "#24272A",
          "$description": "Sunken panels and pills. Generated (two-colour)."
        },
        "border": {
          "$value": "#32363C",
          "$description": "Borders. Generated (two-colour)."
        },
        "text-strong": {
          "$value": "#F5F9FF",
          "$description": "Headings. Generated (two-colour)."
        },
        "text": {
          "$value": "#E5ECF6",
          "$description": "Body text. Generated (two-colour)."
        },
        "text-muted": {
          "$value": "#B8BEC8",
          "$description": "Muted text. Generated (two-colour)."
        },
        "text-subtle": {
          "$value": "#999FA9",
          "$description": "Subtle text. Generated (two-colour)."
        },
        "structure": {
          "$value": "#4383E6",
          "$description": "Primary buttons: brand colour. Generated (two-colour). #1F5FBF moved +0.115 L (OKLCH, hue kept) to clear 4.5:1."
        },
        "accent": {
          "$value": "#F28C28",
          "$description": "Links, focus, kickers: second brand colour. Generated (two-colour)."
        },
        "on-accent": {
          "$value": "#070B12",
          "$description": "Text and icons on the accent. Generated (two-colour)."
        }
      },
      "state": {
        "live": {
          "$value": "#4BC899",
          "$description": "Status: live. Generated (two-colour)."
        },
        "limited": {
          "$value": "#ECBC57",
          "$description": "Status: limited. Generated (two-colour)."
        },
        "purchasing": {
          "$value": "#69A7F4",
          "$description": "Status: purchasing. Generated (two-colour)."
        },
        "closed": {
          "$value": "#F86680",
          "$description": "Status: closed. Generated (two-colour)."
        },
        "evaluation": {
          "$value": "#B8BEC8",
          "$description": "Status: evaluation (muted). Generated (two-colour)."
        }
      },
      "brand": {
        "logo-paint": {
          "$value": "#1F5FBF",
          "$description": "The logo's top brand colour, as supplied."
        }
      }
    }
  },
  "generation": {
    "engine": "0.1.0",
    "extracted": [
      "#1F5FBF",
      "#F28C28"
    ],
    "strategy": "two-colour",
    "settings": {
      "strategies": "faithful,muted,vibrant,neutral-accent,two-colour",
      "primaryCandidate": 0,
      "secondaryCandidate": -1,
      "hueShift": 0,
      "chromaScale": 1,
      "neutralTint": 1,
      "groundLight": 0.985,
      "groundDark": 0.18,
      "stateHarmony": 0.5,
      "minContrast": 4.5,
      "suggestedHue": 250,
      "appearances": "light,dark"
    },
    "logo": {
      "path": "../logos/two-colour.svg",
      "sha256": "755aa25a9c78c2f72338897ae3382d5fa0bb37fbe4d33d785bc4a7f2b79eeeaf"
    }
  }
}
