{
  "$schema": "../schema/brand.schema.json",
  "$description": "Generated in the theme builder by @ux-builder/engine 0.1.0, strategy neutral-accent. Regenerate with: npm run brand -- --regenerate tokens/brands/to-do-vk.brand.json",
  "name": "to-do-vk",
  "title": "To Do Vk",
  "appearances": {
    "light": {
      "color": {
        "ground": {
          "$value": "#FDF9F9",
          "$description": "Page ground. Generated (neutral-accent)."
        },
        "ground-recessed": {
          "$value": "#F4F1F0",
          "$description": "Recessed ground (sidebar). Generated (neutral-accent)."
        },
        "surface": {
          "$value": "#FFFFFF",
          "$description": "Cards, fields and menus. Generated (neutral-accent)."
        },
        "surface-sunken": {
          "$value": "#F3EFEF",
          "$description": "Sunken panels and pills. Generated (neutral-accent)."
        },
        "border": {
          "$value": "#E2DCDC",
          "$description": "Borders. Generated (neutral-accent)."
        },
        "text-strong": {
          "$value": "#1A1514",
          "$description": "Headings. Generated (neutral-accent)."
        },
        "text": {
          "$value": "#282322",
          "$description": "Body text. Generated (neutral-accent)."
        },
        "text-muted": {
          "$value": "#514B4B",
          "$description": "Muted text. Generated (neutral-accent)."
        },
        "text-subtle": {
          "$value": "#686261",
          "$description": "Subtle text. Generated (neutral-accent)."
        },
        "structure": {
          "$value": "#282322",
          "$description": "Primary buttons: neutral ink. Generated (neutral-accent)."
        },
        "accent": {
          "$value": "#B5564F",
          "$description": "Links, focus, kickers: brand colour. Generated (neutral-accent). #CE6D65 moved −0.075 L (OKLCH, hue kept) to clear 4.5:1."
        },
        "on-accent": {
          "$value": "#FAFAFA",
          "$description": "Text and icons on the accent. Generated (neutral-accent). #FFFFFF moved −0.015 L (OKLCH, hue kept) to clear 4.5:1."
        }
      },
      "state": {
        "live": {
          "$value": "#467922",
          "$description": "Status: live. Generated (neutral-accent)."
        },
        "limited": {
          "$value": "#A25900",
          "$description": "Status: limited. Generated (neutral-accent). #A75C00 moved −0.010 L (OKLCH, hue kept) to clear 4.5:1."
        },
        "purchasing": {
          "$value": "#3959A6",
          "$description": "Status: purchasing. Generated (neutral-accent)."
        },
        "closed": {
          "$value": "#B23C00",
          "$description": "Status: closed. Generated (neutral-accent)."
        },
        "evaluation": {
          "$value": "#514B4B",
          "$description": "Status: evaluation (muted). Generated (neutral-accent)."
        }
      },
      "brand": {
        "logo-paint": {
          "$value": "#F93A3B",
          "$description": "The logo's top brand colour, as supplied."
        },
        "logo-image": {
          "$value": "../../brand/to-do-vk/logo.png",
          "$description": "The logo, as uploaded to the theme builder."
        },
        "logo-aspect": {
          "$value": "1.337",
          "$description": "The framed logo's width over its height."
        }
      }
    },
    "dark": {
      "color": {
        "ground": {
          "$value": "#131111",
          "$description": "Page ground. Generated (neutral-accent)."
        },
        "ground-recessed": {
          "$value": "#0D0B0A",
          "$description": "Recessed ground (sidebar). Generated (neutral-accent)."
        },
        "surface": {
          "$value": "#1F1C1C",
          "$description": "Cards, fields and menus. Generated (neutral-accent)."
        },
        "surface-sunken": {
          "$value": "#282625",
          "$description": "Sunken panels and pills. Generated (neutral-accent)."
        },
        "border": {
          "$value": "#383434",
          "$description": "Borders. Generated (neutral-accent)."
        },
        "text-strong": {
          "$value": "#FEF6F6",
          "$description": "Headings. Generated (neutral-accent)."
        },
        "text": {
          "$value": "#F0E9E8",
          "$description": "Body text. Generated (neutral-accent)."
        },
        "text-muted": {
          "$value": "#C3BCBB",
          "$description": "Muted text. Generated (neutral-accent)."
        },
        "text-subtle": {
          "$value": "#A39D9C",
          "$description": "Subtle text. Generated (neutral-accent)."
        },
        "structure": {
          "$value": "#F0E9E8",
          "$description": "Primary buttons: neutral ink. Generated (neutral-accent)."
        },
        "accent": {
          "$value": "#CE6D65",
          "$description": "Links, focus, kickers: brand colour. Generated (neutral-accent)."
        },
        "on-accent": {
          "$value": "#0E0A09",
          "$description": "Text and icons on the accent. Generated (neutral-accent)."
        }
      },
      "state": {
        "live": {
          "$value": "#89C06A",
          "$description": "Status: live. Generated (neutral-accent)."
        },
        "limited": {
          "$value": "#FFB06E",
          "$description": "Status: limited. Generated (neutral-accent)."
        },
        "purchasing": {
          "$value": "#7CA2F6",
          "$description": "Status: purchasing. Generated (neutral-accent)."
        },
        "closed": {
          "$value": "#F86F3C",
          "$description": "Status: closed. Generated (neutral-accent)."
        },
        "evaluation": {
          "$value": "#C3BCBB",
          "$description": "Status: evaluation (muted). Generated (neutral-accent)."
        }
      },
      "brand": {
        "logo-paint": {
          "$value": "#F93A3B",
          "$description": "The logo's top brand colour, as supplied."
        },
        "logo-image": {
          "$value": "../../brand/to-do-vk/logo.png",
          "$description": "The logo, as uploaded to the theme builder."
        },
        "logo-aspect": {
          "$value": "1.337",
          "$description": "The framed logo's width over its height."
        }
      }
    }
  },
  "generation": {
    "engine": "0.1.0",
    "extracted": [
      "#F93A3B",
      "#FCB43D",
      "#97383A"
    ],
    "strategy": "neutral-accent",
    "settings": {
      "strategies": "faithful,muted,vibrant,neutral-accent,two-colour",
      "primaryCandidate": 0,
      "secondaryCandidate": -1,
      "hueShift": 0,
      "chromaScale": 0.55,
      "neutralTint": 1,
      "groundLight": 0.985,
      "groundDark": 0.18,
      "stateHarmony": 0.5,
      "minContrast": 4.5,
      "suggestedHue": 250,
      "appearances": "light,dark"
    },
    "logo": {
      "path": "../../brand/to-do-vk/logo.png",
      "sha256": "32a6876d386dad34bc29111481ce0a2ea23117f0df26cb5bf05955eacb70ea0a"
    }
  }
}
